{
  "$schema": "http://json-schema.org/draft-07/schema#",
  "type": "object",
  "title": "Agent Details",
  "description": "Schema for extracting agent registration details",
  "properties": {
    "agent_name": {
      "type": "string",
      "description": "Full name of the agent (एजेंट का नाम)"
    },
    "agent_id": {
      "type": "string",
      "description": "Unique agent identifier (एजेंट आईडी)"
    },
    "contact_number": {
      "type": "string",
      "description": "Contact phone number (संपर्क नंबर)"
    },
    "alternate_contact": {
      "type": "string",
      "description": "Alternate contact number"
    },
    "email": {
      "type": "string",
      "format": "email",
      "description": "Email address"
    },
    "area": {
      "type": "string",
      "description": "Assigned area or location (क्षेत्र)"
    },
    "district": {
      "type": "string",
      "description": "District name"
    },
    "state": {
      "type": "string",
      "description": "State name"
    },
    "pin_code": {
      "type": "string",
      "description": "PIN code"
    },
    "status": {
      "type": "string",
      "enum": ["Active", "Inactive", "Pending", "Suspended"],
      "description": "Current agent status (स्थिति)"
    },
    "registration_date": {
      "type": "string",
      "description": "Date of registration (पंजीकरण तिथि)"
    },
    "valid_until": {
      "type": "string",
      "description": "Validity end date"
    },
    "supervisor_name": {
      "type": "string",
      "description": "Name of supervising officer"
    },
    "office_address": {
      "type": "string",
      "description": "Office address"
    },
    "confidence": {
      "type": "number",
      "minimum": 0,
      "maximum": 1,
      "description": "Overall confidence score"
    },
    "additional_info": {
      "type": "object",
      "description": "Any additional fields found in the form"
    }
  },
  "required": ["agent_name"]
}
